{
  "confounders": [
    "business cycle",
    "interest rates",
    "industry demand",
    "post-pandemic normalization",
    "offshoring",
    "restructuring",
    "demographics",
    "AI adoption",
    "other technology"
  ],
  "inputManifestHash": "eb44cb456a1787c04d093ea98bdfefc97e54c642abbdefe28a6f9349ec43ec77",
  "interpretationGuardrail": "Observed labor-market changes are not attributed to AI. Age is not job seniority.",
  "mode": "CURRENT_VINTAGE_DESCRIPTIVE",
  "provider": "btos",
  "schemaVersion": "ai-labor-observed-v1",
  "scope": "RESEARCH_ONLY",
  "series": [
    {
      "ageBand": null,
      "denominator": "weighted in-scope employer businesses, including do-not-know responses",
      "evidenceType": "OBSERVED_AI_ADOPTION_CONTEXT",
      "frequency": "biweekly",
      "geography": "US_DC_PUERTO_RICO_BTOS_SCOPE",
      "id": "BTOS_AI_CURRENT_BUSINESS_FUNCTIONS",
      "industry": null,
      "limitations": [
        "Wording histories are not spliced",
        "Expected use is an intention, not realized future adoption",
        "No causal AI attribution",
        "Collection and reference windows are different"
      ],
      "metric": "business_ai_use",
      "missingPeriods": [],
      "observations": [
        {
          "collectionEnd": "2025-11-30",
          "collectionStart": "2025-11-17",
          "footnotes": [],
          "period": "202524",
          "periodEnd": "2025-11-16",
          "periodStart": "2025-11-03",
          "releaseDate": "2025-12-04",
          "responseShares": {
            "do_not_know": 11.1,
            "no": 71.6,
            "yes": 17.3
          },
          "revisionStatus": "revision_unknown",
          "standardError": 0.18,
          "status": "official",
          "value": 17.3
        },
        {
          "collectionEnd": "2025-12-14",
          "collectionStart": "2025-12-01",
          "footnotes": [],
          "period": "202525",
          "periodEnd": "2025-11-30",
          "periodStart": "2025-11-17",
          "releaseDate": "2025-12-18",
          "responseShares": {
            "do_not_know": 10.8,
            "no": 72.0,
            "yes": 17.2
          },
          "revisionStatus": "revision_unknown",
          "standardError": 0.23,
          "status": "official",
          "value": 17.2
        },
        {
          "collectionEnd": "2025-12-28",
          "collectionStart": "2025-12-15",
          "footnotes": [],
          "period": "202526",
          "periodEnd": "2025-12-14",
          "periodStart": "2025-12-01",
          "releaseDate": "2025-12-31",
          "responseShares": {
            "do_not_know": 10.4,
            "no": 71.8,
            "yes": 17.8
          },
          "revisionStatus": "revision_unknown",
          "standardError": 0.47,
          "status": "official",
          "value": 17.8
        },
        {
          "collectionEnd": "2026-01-11",
          "collectionStart": "2025-12-29",
          "footnotes": [],
          "period": "202601",
          "periodEnd": "2025-12-28",
          "periodStart": "2025-12-15",
          "releaseDate": "2026-01-15",
          "responseShares": {
            "do_not_know": 11.2,
            "no": 71.1,
            "yes": 17.7
          },
          "revisionStatus": "revision_unknown",
          "standardError": 0.3,
          "status": "official",
          "value": 17.7
        },
        {
          "collectionEnd": "2026-01-25",
          "collectionStart": "2026-01-12",
          "footnotes": [],
          "period": "202602",
          "periodEnd": "2026-01-11",
          "periodStart": "2025-12-29",
          "releaseDate": "2026-01-29",
          "responseShares": {
            "do_not_know": 10.4,
            "no": 71.4,
            "yes": 18.2
          },
          "revisionStatus": "revision_unknown",
          "standardError": 0.24,
          "status": "official",
          "value": 18.2
        },
        {
          "collectionEnd": "2026-02-08",
          "collectionStart": "2026-01-26",
          "footnotes": [],
          "period": "202603",
          "periodEnd": "2026-01-25",
          "periodStart": "2026-01-12",
          "releaseDate": "2026-02-12",
          "responseShares": {
            "do_not_know": 11.0,
            "no": 70.1,
            "yes": 18.9
          },
          "revisionStatus": "revision_unknown",
          "standardError": 0.39,
          "status": "official",
          "value": 18.9
        },
        {
          "collectionEnd": "2026-02-22",
          "collectionStart": "2026-02-09",
          "footnotes": [],
          "period": "202604",
          "periodEnd": "2026-02-08",
          "periodStart": "2026-01-26",
          "releaseDate": "2026-02-26",
          "responseShares": {
            "do_not_know": 9.4,
            "no": 73.1,
            "yes": 17.5
          },
          "revisionStatus": "revision_unknown",
          "standardError": 0.4,
          "status": "official",
          "value": 17.5
        },
        {
          "collectionEnd": "2026-03-08",
          "collectionStart": "2026-02-23",
          "footnotes": [],
          "period": "202605",
          "periodEnd": "2026-02-22",
          "periodStart": "2026-02-09",
          "releaseDate": "2026-03-12",
          "responseShares": {
            "do_not_know": 9.4,
            "no": 72.4,
            "yes": 18.2
          },
          "revisionStatus": "revision_unknown",
          "standardError": 0.32,
          "status": "official",
          "value": 18.2
        },
        {
          "collectionEnd": "2026-03-22",
          "collectionStart": "2026-03-09",
          "footnotes": [],
          "period": "202606",
          "periodEnd": "2026-03-08",
          "periodStart": "2026-02-23",
          "releaseDate": "2026-03-26",
          "responseShares": {
            "do_not_know": 9.1,
            "no": 72.0,
            "yes": 18.9
          },
          "revisionStatus": "revision_unknown",
          "standardError": 0.32,
          "status": "official",
          "value": 18.9
        },
        {
          "collectionEnd": "2026-04-05",
          "collectionStart": "2026-03-23",
          "footnotes": [],
          "period": "202607",
          "periodEnd": "2026-03-22",
          "periodStart": "2026-03-09",
          "releaseDate": "2026-04-09",
          "responseShares": {
            "do_not_know": 9.1,
            "no": 71.8,
            "yes": 19.1
          },
          "revisionStatus": "revision_unknown",
          "standardError": 0.42,
          "status": "official",
          "value": 19.1
        },
        {
          "collectionEnd": "2026-04-19",
          "collectionStart": "2026-04-06",
          "footnotes": [],
          "period": "202608",
          "periodEnd": "2026-04-05",
          "periodStart": "2026-03-23",
          "releaseDate": "2026-04-23",
          "responseShares": {
            "do_not_know": 9.3,
            "no": 70.9,
            "yes": 19.8
          },
          "revisionStatus": "revision_unknown",
          "standardError": 0.29,
          "status": "official",
          "value": 19.8
        },
        {
          "collectionEnd": "2026-05-03",
          "collectionStart": "2026-04-20",
          "footnotes": [],
          "period": "202609",
          "periodEnd": "2026-04-19",
          "periodStart": "2026-04-06",
          "releaseDate": "2026-05-07",
          "responseShares": {
            "do_not_know": 9.1,
            "no": 71.1,
            "yes": 19.8
          },
          "revisionStatus": "revision_unknown",
          "standardError": 0.24,
          "status": "official",
          "value": 19.8
        },
        {
          "collectionEnd": "2026-05-17",
          "collectionStart": "2026-05-04",
          "footnotes": [],
          "period": "202610",
          "periodEnd": "2026-05-03",
          "periodStart": "2026-04-20",
          "releaseDate": "2026-05-21",
          "responseShares": {
            "do_not_know": 10.2,
            "no": 70.3,
            "yes": 19.5
          },
          "revisionStatus": "revision_unknown",
          "standardError": 0.24,
          "status": "official",
          "value": 19.5
        },
        {
          "collectionEnd": "2026-05-31",
          "collectionStart": "2026-05-18",
          "footnotes": [],
          "period": "202611",
          "periodEnd": "2026-05-17",
          "periodStart": "2026-05-04",
          "releaseDate": "2026-06-04",
          "responseShares": {
            "do_not_know": 9.9,
            "no": 69.6,
            "yes": 20.6
          },
          "revisionStatus": "revision_unknown",
          "standardError": 0.29,
          "status": "official",
          "value": 20.6
        },
        {
          "collectionEnd": "2026-06-14",
          "collectionStart": "2026-06-01",
          "footnotes": [],
          "period": "202612",
          "periodEnd": "2026-05-31",
          "periodStart": "2026-05-18",
          "releaseDate": "2026-06-18",
          "responseShares": {
            "do_not_know": 10.0,
            "no": 69.4,
            "yes": 20.6
          },
          "revisionStatus": "revision_unknown",
          "standardError": 0.27,
          "status": "official",
          "value": 20.6
        },
        {
          "collectionEnd": "2026-06-28",
          "collectionStart": "2026-06-15",
          "footnotes": [],
          "period": "202613",
          "periodEnd": "2026-06-14",
          "periodStart": "2026-06-01",
          "releaseDate": "2026-07-02",
          "responseShares": {
            "do_not_know": 10.7,
            "no": 68.7,
            "yes": 20.6
          },
          "revisionStatus": "revision_unknown",
          "standardError": 0.39,
          "status": "official",
          "value": 20.6
        },
        {
          "collectionEnd": "2026-07-12",
          "collectionStart": "2026-06-29",
          "footnotes": [],
          "period": "202614",